[
  {
    "url": "https://gitlab.com/wybgit/surge_conf/-/raw/main/gist_config/zzzZZzzZZee_clash.yaml",
    "category": "yaml",
    "type": "clash_yaml",
    "format": "object",
    "encoding": "plain",
    "description": "Clash YAML object (proxy list or config)"
  },
  {
    "url": "https://gitlab.com/wybgit/surge_conf/-/raw/main/top_size/yb_v2rayse_sub.yaml",
    "category": "yaml",
    "type": "clash_yaml",
    "format": "object",
    "encoding": "plain",
    "description": "Clash YAML object (proxy list or config)"
  },
  {
    "url": "https://gitlab.com/wybgit/surge_conf/-/raw/main/top_size/yb_v2rayse_sub1.yaml",
    "category": "yaml",
    "type": "clash_yaml",
    "format": "object",
    "encoding": "plain",
    "description": "Clash YAML object (proxy list or config)"
  },
  {
    "url": "https://gitlab.com/wybgit/surge_conf/-/raw/main/gist_config/xiaotu9639_clash.yaml",
    "category": "yaml",
    "type": "clash_yaml",
    "format": "object",
    "encoding": "plain",
    "description": "Clash YAML object (proxy list or config)"
  },
  {
    "url": "https://gitlab.com/wybgit/surge_conf/-/raw/main/github_config/Surfboardv2ray_Proxy-sorter_clash.yaml",
    "category": "yaml",
    "type": "clash_yaml",
    "format": "object",
    "encoding": "plain",
    "description": "Clash YAML object (proxy list or config)"
  },
  {
    "url": "https://gitlab.com/wybgit/surge_conf/-/raw/main/github_config/freeorgOP.yaml",
    "category": "yaml",
    "type": "clash_yaml",
    "format": "object",
    "encoding": "plain",
    "description": "Clash YAML object (proxy list or config)"
  },
  {
    "url": "https://gitlab.com/wybgit/surge_conf/-/raw/main/gist_config/CKCat_clash.yaml",
    "category": "yaml",
    "type": "clash_yaml",
    "format": "object",
    "encoding": "plain",
    "description": "Clash YAML object (proxy list or config)"
  },
  {
    "url": "https://gitlab.com/wybgit/surge_conf/-/raw/main/gist_config/ye4241_clash.yaml",
    "category": "yaml",
    "type": "clash_yaml",
    "format": "object",
    "encoding": "plain",
    "description": "Clash YAML object (proxy list or config)"
  },
  {
    "url": "https://gitlab.com/wybgit/surge_conf/-/raw/main/gist_config/Cyndri_clash.yaml",
    "category": "yaml",
    "type": "clash_yaml",
    "format": "object",
    "encoding": "plain",
    "description": "Clash YAML object (proxy list or config)"
  },
  {
    "url": "https://raw.githubusercontent.com/anaer/Sub/refs/heads/main/clash.yaml",
    "category": "yaml",
    "type": "clash_yaml",
    "format": "object",
    "encoding": "plain",
    "description": "Clash YAML object (proxy list or config)"
  },
  {
    "url": "https://raw.githubusercontent.com/wangyingbo/v2rayse_sub/refs/heads/main/clashv2ray-hub_clashfree_sub/clashfree_clash.yaml",
    "category": "yaml",
    "type": "clash_yaml",
    "format": "object",
    "encoding": "plain",
    "description": "Clash YAML object (proxy list or config)"
  },
  {
    "url": "https://raw.githubusercontent.com/snakem982/proxypool/main/source/clash-meta.yaml",
    "category": "yaml",
    "type": "clash_yaml",
    "format": "object",
    "encoding": "plain",
    "description": "Clash YAML object (proxy list or config)"
  },
  {
    "url": "https://raw.githubusercontent.com/snakem982/proxypool/main/source/clash-meta-2.yaml",
    "category": "yaml",
    "type": "clash_yaml",
    "format": "object",
    "encoding": "plain",
    "description": "Clash YAML object (proxy list or config)"
  },
  {
    "url": "https://raw.githubusercontent.com/aiboboxx/clashfree/main/clash.yml",
    "category": "yaml",
    "type": "clash_yaml",
    "format": "object",
    "encoding": "plain",
    "description": "Clash YAML object (proxy list or config)"
  },
  {
    "url": "https://raw.githubusercontent.com/anaer/Sub/main/clash.yaml",
    "category": "yaml",
    "type": "clash_yaml",
    "format": "object",
    "encoding": "plain",
    "description": "Clash YAML object (proxy list or config)"
  },
  {
    "url": "https://raw.githubusercontent.com/chengaopan/AutoMergePublicNodes/master/list.yml",
    "category": "yaml",
    "type": "clash_yaml",
    "format": "object",
    "encoding": "plain",
    "description": "Clash YAML object (proxy list or config)"
  },
  {
    "url": "https://raw.githubusercontent.com/mahdibland/V2RayAggregator/master/sub/sub_merge_yaml.yml",
    "category": "yaml",
    "type": "clash_yaml",
    "format": "object",
    "encoding": "plain",
    "description": "Clash YAML object (proxy list or config)"
  },
  {
    "url": "https://raw.githubusercontent.com/mheidari98/.proxy/main/all",
    "category": "subscription",
    "protocols": [
      "ss",
      "trojan",
      "vless",
      "vmess"
    ],
    "valid": true,
    "raw_lines": 25669,
    "type": "subscription_base64",
    "encoding": "base64",
    "format": "subscription_list",
    "description": "Base64-encoded subscription list (each line is a proxy link, protocols detected)"
  },
  {
    "url": "https://raw.githubusercontent.com/NiceVPN123/NiceVPN/main/Clash.yaml",
    "category": "yaml",
    "type": "clash_yaml",
    "format": "object",
    "encoding": "plain",
    "description": "Clash YAML object (proxy list or config)"
  },
  {
    "url": "https://raw.githubusercontent.com/zhangkaiitugithub/passcro/main/speednodes.yaml",
    "category": "yaml",
    "type": "clash_yaml",
    "format": "object",
    "encoding": "plain",
    "description": "Clash YAML object (proxy list or config)"
  },
  {
    "url": "https://raw.githubusercontent.com/peasoft/NoMoreWalls/master/list.yml",
    "category": "yaml",
    "type": "clash_yaml",
    "format": "object",
    "encoding": "plain",
    "description": "Clash YAML object (proxy list or config)"
  },
  {
    "url": "https://raw.githubusercontent.com/lagzian/SS-Collector/main/mix_clash.yaml",
    "category": "yaml",
    "type": "clash_yaml",
    "format": "object",
    "encoding": "plain",
    "description": "Clash YAML object (proxy list or config)"
  },
  {
    "url": "https://raw.githubusercontent.com/MrMohebi/xray-proxy-grabber-telegram/master/collected-proxies/clash-meta/all.yaml",
    "category": "yaml",
    "type": "clash_yaml",
    "format": "object",
    "encoding": "plain",
    "description": "Clash YAML object (proxy list or config)"
  },
  {
    "url": "https://raw.githubusercontent.com/Misaka-blog/chromego_merge/main/sub/merged_proxies_new.yaml",
    "category": "yaml",
    "type": "clash_yaml",
    "format": "object",
    "encoding": "plain",
    "description": "Clash YAML object (proxy list or config)"
  },
  {
    "url": "https://github.com/Epodonios/v2ray-configs/raw/main/All_Configs_Sub.txt",
    "category": "subscription",
    "protocols": [
      "ss",
      "trojan",
      "vless",
      "vmess"
    ],
    "valid": true,
    "raw_lines": 18080,
    "type": "subscription_plain",
    "encoding": "plain",
    "format": "subscription_list",
    "description": "Plain text subscription list (valid proxy links: 18080, ignored lines: 9)"
  },
  {
    "url": "https://raw.githubusercontent.com/Leon406/SubCrawler/refs/heads/main/sub/subs.txt",
    "category": "subscription",
    "protocols": [
      "ss",
      "trojan",
      "vmess"
    ],
    "valid": true,
    "raw_lines": 6,
    "type": "subscription_plain",
    "encoding": "plain",
    "format": "subscription_list",
    "description": "Plain text subscription list (valid proxy links: 6, ignored lines: 2)"
  },
  {
    "url": "https://raw.githubusercontent.com/snakem982/proxypool/main/source/v2ray.txt",
    "category": "unknown",
    "type": "unknown",
    "format": "unknown",
    "encoding": "plain",
    "protocols": [],
    "description": "Unknown or unsupported format"
  },
  {
    "url": "https://raw.githubusercontent.com/snakem982/proxypool/main/source/v2ray-2.txt",
    "category": "subscription",
    "protocols": [
      "hysteria",
      "ss",
      "trojan",
      "vless",
      "vmess"
    ],
    "valid": true,
    "raw_lines": 96,
    "type": "subscription_base64",
    "encoding": "base64",
    "format": "subscription_list",
    "description": "Base64-encoded subscription list (each line is a proxy link, protocols detected)"
  },
  {
    "url": "https://raw.githubusercontent.com/soroushmirzaei/telegram-configs-collector/main/protocols/hysteria",
    "category": "subscription",
    "protocols": [
      "hysteria",
      "vless"
    ],
    "valid": true,
    "raw_lines": 234,
    "type": "subscription_base64",
    "encoding": "base64",
    "format": "subscription_list",
    "description": "Base64-encoded subscription list (each line is a proxy link, protocols detected)"
  },
  {
    "url": "https://raw.githubusercontent.com/soroushmirzaei/telegram-configs-collector/main/protocols/vmess",
    "category": "subscription",
    "protocols": [
      "vmess"
    ],
    "valid": true,
    "raw_lines": 198,
    "type": "subscription_base64",
    "encoding": "base64",
    "format": "subscription_list",
    "description": "Base64-encoded subscription list (each line is a proxy link, protocols detected)"
  },
  {
    "url": "https://raw.githubusercontent.com/soroushmirzaei/telegram-configs-collector/main/protocols/vless",
    "category": "subscription",
    "protocols": [
      "vless"
    ],
    "valid": true,
    "raw_lines": 13450,
    "type": "subscription_base64",
    "encoding": "base64",
    "format": "subscription_list",
    "description": "Base64-encoded subscription list (each line is a proxy link, protocols detected)"
  },
  {
    "url": "https://raw.githubusercontent.com/soroushmirzaei/telegram-configs-collector/main/protocols/trojan",
    "category": "subscription",
    "protocols": [
      "trojan"
    ],
    "valid": true,
    "raw_lines": 2557,
    "type": "subscription_base64",
    "encoding": "base64",
    "format": "subscription_list",
    "description": "Base64-encoded subscription list (each line is a proxy link, protocols detected)"
  },
  {